{
  "session_id": "262b08df-d7e0-4395-ae3d-eeb36a36d425",
  "start_time": 1762612985.7071693,
  "end_time": 1762612994.249622,
  "goal": "Test AI agent actions",
  "snapshots": [
    {
      "snapshot_id": "ef4eaa37-89ca-4b56-a40d-14c25f6f24cd",
      "timestamp": 1762612985.724122,
      "keyboard_events": [],
      "mouse_events": [],
      "screen_state": {
        "timestamp": 1762612986.0556846,
        "screenshot_path": "test_training_data\\screenshots\\screenshot_1762612985891.png",
        "screenshot_data": null,
        "resolution": {
          "width": 1920,
          "height": 1080
        },
        "cursor_position": {
          "x": 809,
          "y": 945
        }
      },
      "system_state": {
        "timestamp": 1762612986.2136714,
        "active_window": {
          "title": "Self car web - Cursor [Administrator]",
          "rect": [
            -9,
            -9,
            1929,
            1029
          ]
        },
        "clipboard": "Cannot connect to server. Please make sure the Python backend is running on port 8001.",
        "cpu_percent": 1.6,
        "memory_percent": 82.6,
        "running_processes": [],
        "network_activity": null
      },
      "metadata": {}
    },
    {
      "snapshot_id": "82b5411e-3b5e-460a-ba8a-1a1963ba34da",
      "timestamp": 1762612986.2752025,
      "keyboard_events": [
        {
          "timestamp": 1762612985.729126,
          "event_type": "press",
          "key": "r",
          "key_code": null,
          "modifiers": [],
          "is_special": false,
          "text": "r"
        },
        {
          "timestamp": 1762612985.8317223,
          "event_type": "release",
          "key": "e",
          "key_code": null,
          "modifiers": [],
          "is_special": false,
          "text": "e"
        },
        {
          "timestamp": 1762612985.8667195,
          "event_type": "release",
          "key": "r",
          "key_code": null,
          "modifiers": [],
          "is_special": false,
          "text": "r"
        },
        {
          "timestamp": 1762612985.9419994,
          "event_type": "press",
          "key": "space",
          "key_code": null,
          "modifiers": [],
          "is_special": true,
          "text": null
        },
        {
          "timestamp": 1762612986.0536802,
          "event_type": "release",
          "key": "space",
          "key_code": null,
          "modifiers": [],
          "is_special": true,
          "text": null
        },
        {
          "timestamp": 1762612986.174549,
          "event_type": "press",
          "key": "i",
          "key_code": null,
          "modifiers": [],
          "is_special": false,
          "text": "i"
        }
      ],
      "mouse_events": [],
      "screen_state": {
        "timestamp": 1762612986.4489512,
        "screenshot_path": "test_training_data\\screenshots\\screenshot_1762612986345.png",
        "screenshot_data": null,
        "resolution": {
          "width": 1920,
          "height": 1080
        },
        "cursor_position": {
          "x": 809,
          "y": 945
        }
      },
      "system_state": {
        "timestamp": 1762612986.5949852,
        "active_window": {
          "title": "Self car web - Cursor [Administrator]",
          "rect": [
            -9,
            -9,
            1929,
            1029
          ]
        },
        "clipboard": "Cannot connect to server. Please make sure the Python backend is running on port 8001.",
        "cpu_percent": 3.6,
        "memory_percent": 82.6,
        "running_processes": [
          "Cursor.exe",
          "System Idle Process",
          "WmiPrvSE.exe",
          "dwm.exe",
          "python.exe"
        ],
        "network_activity": null
      },
      "metadata": {}
    },
    {
      "snapshot_id": "c1cb1dd6-3b45-45c8-b2ed-860ced3b7bc2",
      "timestamp": 1762612986.6515713,
      "keyboard_events": [
        {
          "timestamp": 1762612986.2962706,
          "event_type": "release",
          "key": "i",
          "key_code": null,
          "modifiers": [],
          "is_special": false,
          "text": "i"
        },
        {
          "timestamp": 1762612986.3969183,
          "event_type": "press",
          "key": "space",
          "key_code": null,
          "modifiers": [],
          "is_special": true,
          "text": null
        },
        {
          "timestamp": 1762612986.5568564,
          "event_type": "release",
          "key": "space",
          "key_code": null,
          "modifiers": [],
          "is_special": true,
          "text": null
        }
      ],
      "mouse_events": [],
      "screen_state": {
        "timestamp": 1762612986.7475266,
        "screenshot_path": "test_training_data\\screenshots\\screenshot_1762612986693.png",
        "screenshot_data": null,
        "resolution": {
          "width": 1920,
          "height": 1080
        },
        "cursor_position": {
          "x": 809,
          "y": 945
        }
      },
      "system_state": {
        "timestamp": 1762612986.8711953,
        "active_window": {
          "title": "Self car web - Cursor [Administrator]",
          "rect": [
            -9,
            -9,
            1929,
            1029
          ]
        },
        "clipboard": "Cannot connect to server. Please make sure the Python backend is running on port 8001.",
        "cpu_percent": 4.2,
        "memory_percent": 82.6,
        "running_processes": [
          "ChatGPT.exe",
          "Cursor.exe",
          "MsMpEng.exe",
          "System Idle Process",
          "java.exe",
          "python.exe"
        ],
        "network_activity": null
      },
      "metadata": {}
    },
    {
      "snapshot_id": "71c61703-6e2c-4a8e-97c0-798972866910",
      "timestamp": 1762612986.930481,
      "keyboard_events": [],
      "mouse_events": [],
      "screen_state": {
        "timestamp": 1762612987.0426087,
        "screenshot_path": "test_training_data\\screenshots\\screenshot_1762612986983.png",
        "screenshot_data": null,
        "resolution": {
          "width": 1920,
          "height": 1080
        },
        "cursor_position": {
          "x": 809,
          "y": 945
        }
      },
      "system_state": {
        "timestamp": 1762612987.1703222,
        "active_window": {
          "title": "Self car web - Cursor [Administrator]",
          "rect": [
            -9,
            -9,
            1929,
            1029
          ]
        },
        "clipboard": "Cannot connect to server. Please make sure the Python backend is running on port 8001.",
        "cpu_percent": 0.0,
        "memory_percent": 82.6,
        "running_processes": [
          "ChatGPT.exe",
          "Cursor.exe",
          "NordVPN.exe",
          "System",
          "System Idle Process",
          "java.exe",
          "python.exe"
        ],
        "network_activity": null
      },
      "metadata": {}
    },
    {
      "snapshot_id": "b362bdb1-ddc1-4191-be21-bb5f75aad398",
      "timestamp": 1762612987.2270346,
      "keyboard_events": [
        {
          "timestamp": 1762612987.0633156,
          "event_type": "press",
          "key": "c",
          "key_code": null,
          "modifiers": [],
          "is_special": false,
          "text": "c"
        },
        {
          "timestamp": 1762612987.170841,
          "event_type": "release",
          "key": "c",
          "key_code": null,
          "modifiers": [],
          "is_special": false,
          "text": "c"
        },
        {
          "timestamp": 1762612987.197783,
          "event_type": "press",
          "key": "l",
          "key_code": null,
          "modifiers": [],
          "is_special": false,
          "text": "l"
        }
      ],
      "mouse_events": [],
      "screen_state": {
        "timestamp": 1762612987.3491333,
        "screenshot_path": "test_training_data\\screenshots\\screenshot_1762612987290.png",
        "screenshot_data": null,
        "resolution": {
          "width": 1920,
          "height": 1080
        },
        "cursor_position": {
          "x": 809,
          "y": 945
        }
      },
      "system_state": {
        "timestamp": 1762612987.491212,
        "active_window": {
          "title": "Self car web - Cursor [Administrator]",
          "rect": [
            -9,
            -9,
            1929,
            1029
          ]
        },
        "clipboard": "Cannot connect to server. Please make sure the Python backend is running on port 8001.",
        "cpu_percent": 8.9,
        "memory_percent": 82.8,
        "running_processes": [
          "Cursor.exe",
          "MsMpEng.exe",
          "System",
          "System Idle Process",
          "dwm.exe",
          "java.exe",
          "python.exe"
        ],
        "network_activity": null
      },
      "metadata": {}
    },
    {
      "snapshot_id": "2308e7b3-c327-4860-89f7-ba3da52d572e",
      "timestamp": 1762612987.554212,
      "keyboard_events": [
        {
          "timestamp": 1762612987.2811658,
          "event_type": "release",
          "key": "l",
          "key_code": null,
          "modifiers": [],
          "is_special": false,
          "text": "l"
        },
        {
          "timestamp": 1762612987.436173,
          "event_type": "press",
          "key": "o",
          "key_code": null,
          "modifiers": [],
          "is_special": false,
          "text": "o"
        },
        {
          "timestamp": 1762612987.491212,
          "event_type": "release",
          "key": "o",
          "key_code": null,
          "modifiers": [],
          "is_special": false,
          "text": "o"
        },
        {
          "timestamp": 1762612987.5422115,
          "event_type": "press",
          "key": "s",
          "key_code": null,
          "modifiers": [],
          "is_special": false,
          "text": "s"
        }
      ],
      "mouse_events": [],
      "screen_state": {